name,id,date,text,polarity,retweet,fav,follower,friendscount,avg_re,avg_fav
BarackObama,9.82E+17,04-04-2018 14:35,"b'RT @ObamaFoundation: This week\xe2\x80\x9450 years since Dr. Martin Luther King, Jr. was killed\xe2\x80\x94@BarackObama and @RepJohnLewis sat down with a group o\xe2\x80\xa6'",-4,12828,0,101652970,623384,5956,20389
BarackObama,9.78E+17,25-03-2018 15:34,b'Incredible to have a Chicago team in the Final Four. I\xe2\x80\x99ll take that over an intact bracket any day! Congratulations\xe2\x80\xa6 https://t.co/V9IbaSlbIp',4,20178,223663,101652970,623384,5956,20389
BarackObama,9.78E+17,24-03-2018 17:07,b'Michelle and I are so inspired by all the young people who made today\xe2\x80\x99s marches happen. Keep at it. You\xe2\x80\x99re leading\xe2\x80\xa6 https://t.co/d0DTg594Cs',4,328422,1591919,101652970,623384,5956,20389
BarackObama,9.76E+17,19-03-2018 21:48,b'Our most important task as a nation is to make sure all our young people can achieve their dreams. We\xe2\x80\x99ve started th\xe2\x80\xa6 https://t.co/gNw9ks6pMY',4,27306,137598,101652970,623384,5956,20389
BarackObama,9.76E+17,19-03-2018 15:10,"b'In Singapore with young people who are advocating for education, empowering young women, and getting involved all o\xe2\x80\xa6 https://t.co/V5uHCeMWUa'",4,26533,173985,101652970,623384,5956,20389
BarackObama,9.74E+17,16-03-2018 00:22,b'41: I like the competition. And the loyalty to the home team. - 44 https://t.co/XG3ChMtW0M',0,29941,281448,101652970,623384,5956,20389
BarackObama,9.74E+17,15-03-2018 23:16,b'Congrats to @LoyolaChicago and Sister Jean for a last-second upset - I had faith in my pick!',0,13179,130989,101652970,623384,5956,20389
BarackObama,9.74E+17,14-03-2018 20:12,"b'Just because I have more time to watch games doesn\xe2\x80\x99t mean my picks will be better, but here are my brackets this ye\xe2\x80\xa6 https://t.co/gWpZwlceV3'",4,39592,265293,101652970,623384,5956,20389
BarackObama,9.74E+17,14-03-2018 14:58,b'Have fun out there among the stars. https://t.co/S285MTwGtp',4,275435,1445291,101652970,623384,5956,20389
BarackObama,9.73E+17,12-03-2018 18:12,"b'Four years ago, @MichelleObama and I had the privilege to host Lt. Cmdr. Dan Cnossen and his fellow Paralympians an\xe2\x80\xa6 https://t.co/kneWyU2Tu1'",0,19603,172888,101652970,623384,5956,20389
BarackObama,9.69E+17,28-02-2018 02:58,"b'I got my start holding community meetings in Chicago, so it was fun to be home for one tonight. Michelle and I want\xe2\x80\xa6 https://t.co/1ammpZayJx'",4,37756,240590,101652970,623384,5956,20389
BarackObama,9.67E+17,22-02-2018 16:00,"b'Young people have helped lead all our great movements. How inspiring to see it again in so many smart, fearless stu\xe2\x80\xa6 https://t.co/wXO3wBtJ8V'",4,454030,1651960,101652970,623384,5956,20389
BarackObama,9.66E+17,21-02-2018 16:33,"b'Billy Graham was a humble servant who prayed for so many - and who, with wisdom and grace, gave hope and guidance t\xe2\x80\xa6 https://t.co/V8WtgIRPEB'",4,35342,258762,101652970,623384,5956,20389
BarackObama,9.64E+17,15-02-2018 17:12,b'We are grieving with Parkland. But we are not powerless. Caring for our kids is our first job. And until we can hon\xe2\x80\xa6 https://t.co/LWGSkzRapH',4,382110,1327232,101652970,623384,5956,20389
BarackObama,9.64E+17,14-02-2018 16:25,"b'Happy Valentine\xe2\x80\x99s Day, @MichelleObama. You make every day and every place better. https://t.co/aWvyytR7Mm'",4,244954,1528685,101652970,623384,5956,20389
BarackObama,9.64E+17,14-02-2018 16:24,"b'RT @MichelleObama: Happy #ValentinesDay to my one and only, @BarackObama. To celebrate the occasion, I\xe2\x80\x99m dedicating a little Valentine\xe2\x80\x99s Da\xe2\x80\xa6'",4,26856,0,101652970,623384,5956,20389
BarackObama,9.53E+17,15-01-2018 14:46,"b'Dr. King was 26 when the Montgomery bus boycott began. He started small, rallying others who believed their efforts\xe2\x80\xa6 https://t.co/N0zwBg7gTi'",-4,376272,1467622,101652970,623384,5956,20389
BarackObama,9.47E+17,29-12-2017 16:11,"b'All across America people chose to get involved, get engaged and stand up. Each of us can make a difference, and al\xe2\x80\xa6 https://t.co/zxpKVnNeHZ'",0,116267,505845,101652970,623384,5956,20389
BarackObama,9.47E+17,29-12-2017 16:10,"b'Ten-year-old Jahkil Jackson is on a mission to help homeless people in Chicago. He created kits full of socks, toil\xe2\x80\xa6 https://t.co/7mNk6dmnyC'",4,49407,309088,101652970,623384,5956,20389
BarackObama,9.47E+17,29-12-2017 16:10,"b'Chris Long gave his paychecks from the first six games of the NFL season to fund scholarships in Charlottesville, V\xe2\x80\xa6 https://t.co/KxUk5Wle6h'",4,67680,270843,101652970,623384,5956,20389
BarackObama,9.47E+17,29-12-2017 16:09,"b'Kat Creech, a wedding planner in Houston, turned a postponed wedding into a volunteer opportunity for Hurricane Har\xe2\x80\xa6 https://t.co/MCXiSuAVJN'",0,23932,156215,101652970,623384,5956,20389
BarackObama,9.47E+17,29-12-2017 16:09,"b'As we count down to the new year, we get to reflect and prepare for what\xe2\x80\x99s ahead. For all the bad news that seemed\xe2\x80\xa6 https://t.co/WaUHkVww2g'",-4,177865,786203,101652970,623384,5956,20389
BarackObama,9.46E+17,27-12-2017 21:02,"b'RT @MBK_Alliance: I am my Brother\xe2\x80\x99s Keeper. \nWatch our new PSA with @BarackObama, @StephenCurry30 &amp; @chancetherapper, then take action to s\xe2\x80\xa6'",4,7368,0,101652970,623384,5956,20389
BarackObama,9.45E+17,25-12-2017 16:05,"b'On behalf of the Obama family, Merry Christmas! We wish you joy and peace this holiday season. https://t.co/CNFUZrhrBj'",4,253037,1477153,101652970,623384,5956,20389
BarackObama,9.41E+17,14-12-2017 22:39,"b""There's no better time than the holiday season to reach out and give back to our communities. Great to hear from yo\xe2\x80\xa6 https://t.co/gp5dCy9oN2""",4,59966,415897,101652970,623384,5956,20389
BarackObama,9.41E+17,13-12-2017 00:17,"b'Happy Hanukkah, everybody, from the Obama family to yours. Chag Sameach!'",4,85064,691364,101652970,623384,5956,20389
BarackObama,9.40E+17,11-12-2017 20:16,b'Just got off a call to thank folks who are working hard to help more Americans across the country sign up for healt\xe2\x80\xa6 https://t.co/A9QvCySWJ8',4,87327,226661,101652970,623384,5956,20389
BarackObama,9.38E+17,04-12-2017 22:57,b'RT @ObamaFoundation: Watch: We hosted a Town Hall in New Delhi with @BarackObama and young leaders about how to drive change and make an im\xe2\x80\xa6',4,6704,0,101652970,623384,5956,20389
BarackObama,9.35E+17,27-11-2017 21:13,b'Michelle and I are delighted to congratulate Prince Harry and Meghan Markle on their engagement. We wish you a life\xe2\x80\xa6 https://t.co/KC9nmjZPuX',4,115048,1161510,101652970,623384,5956,20389
BarackObama,9.34E+17,23-11-2017 14:44,"b'From the Obama family to yours, we wish you a Happy Thanksgiving full of joy and gratitude. https://t.co/xAvSQwjQkz'",4,214658,1386577,101652970,623384,5956,20389
BarackObama,9.33E+17,20-11-2017 19:02,"b'ME:  Joe, about halfway through the speech, I\xe2\x80\x99m gonna wish you a happy birth--\nBIDEN:  IT\xe2\x80\x99S MY BIRTHDAY!\nME:  Joe.\xe2\x80\xa6 https://t.co/5qLUsDoaMi'",4,504532,2013087,101652970,623384,5956,20389
BarackObama,9.29E+17,11-11-2017 15:13,"b'RT @ObamaFoundation: Today, we honor those who have honored our country with its highest form of service. https://t.co/IbJNCwIofL https://t\xe2\x80\xa6'",0,8914,0,101652970,623384,5956,20389
BarackObama,9.28E+17,08-11-2017 13:25,b'This is what happens when the people vote. Congrats @RalphNortham and @PhilMurphyNJ . And congratulations to all th\xe2\x80\xa6 https://t.co/ZvUKZIDGAj',0,73257,430096,101652970,623384,5956,20389
BarackObama,9.28E+17,07-11-2017 01:02,b'Every election matters - those who show up determine our future. Go vote tomorrow! https://t.co/j1wh8hLamw',0,58170,193099,101652970,623384,5956,20389
BarackObama,9.27E+17,06-11-2017 00:51,b'May God also grant all of us the wisdom to ask what concrete steps we can take to reduce the violence and weaponry in our midst.',4,117360,507921,101652970,623384,5956,20389
BarackObama,9.27E+17,06-11-2017 00:51,"b'We grieve with all the families in Sutherland Springs harmed by this act of hatred, and we\xe2\x80\x99ll stand with the survivors as they recover...'",0,96678,547354,101652970,623384,5956,20389
BarackObama,9.26E+17,01-11-2017 13:06,"b'Starting today, you can sign up for 2018 health coverage. Head on over to https://t.co/ob1Ynoesod and find a plan t\xe2\x80\xa6 https://t.co/6eN1Y5TQGV'",0,136536,256619,101652970,623384,5956,20389
BarackObama,9.26E+17,01-11-2017 00:56,"b""Michelle and I are thinking of the victims of today's attack in NYC and everyone who keeps us safe. New Yorkers are as tough as they come.""",4,103281,705051,101652970,623384,5956,20389
BarackObama,9.25E+17,30-10-2017 21:36,"b'Hello, #ObamaSummit! Thrilled to host civic leaders in Chicago from all over the world. Follow along at @ObamaFoundation.'",4,21440,180381,101652970,623384,5956,20389
BarackObama,9.23E+17,23-10-2017 22:03,"b'I\xe2\x80\x99ll let you and @ladygaga handle the singing, and we\xe2\x80\x99ll handle the donations. There\xe2\x80\x99s still time to give:\xe2\x80\xa6 https://t.co/0NnaR3bozh'",-4,54519,309460,101652970,623384,5956,20389
BarackObama,9.22E+17,22-10-2017 00:02,b'Tonight the ex-Presidents are getting together in Texas to support all our fellow Americans rebuilding from this ye\xe2\x80\xa6 https://t.co/nFSou6JC6n',0,83204,503056,101652970,623384,5956,20389
BarackObama,9.20E+17,16-10-2017 22:59,"b""I'm grateful to @SenJohnMcCain for his lifetime of service to our country. Congratulations, John, on receiving this year's Liberty Medal.""",0,91826,675380,101652970,623384,5956,20389
BarackObama,9.15E+17,02-10-2017 12:41,b'Michelle &amp; I are praying for the victims in Las Vegas. Our thoughts are with their families &amp; everyone enduring another senseless tragedy.',0,396676,1702464,101652970,623384,5956,20389
BarackObama,9.14E+17,30-09-2017 02:22,b'Proud to cheer on Team USA at the Invictus Games today with my friend Joe. You represent the best of our country. https://t.co/WBzcltmgqj',4,60558,507869,101652970,623384,5956,20389
BarackObama,9.13E+17,26-09-2017 17:03,"b""We're expanding our efforts to help Puerto Rico &amp; the USVI, where our fellow Americans need us right now. Join us a\xe2\x80\xa6 https://t.co/gkrp1RwXR4""",4,112800,335934,101652970,623384,5956,20389
BarackObama,9.12E+17,25-09-2017 23:36,"b'Prosecutor, soldier, family man, citizen. Beau made us want to be better. What a legacy to leave. What a testament\xe2\x80\xa6 https://t.co/XDtkLu32wd'",4,58075,329062,101652970,623384,5956,20389
BarackObama,9.11E+17,20-09-2017 16:32,b'RT @gatesfoundation: President @BarackObama addresses #Goalkeepers17 starting at 12:40 PM. Tune in here: https://t.co/XmHBErSHYw',0,2767,0,101652970,623384,5956,20389
BarackObama,9.10E+17,20-09-2017 02:30,b'Thinking about our neighbors in Mexico and all our Mexican-American friends tonight. Cuidense mucho y un fuerte abrazo para todos.',0,439886,1487289,101652970,623384,5956,20389
BarackObama,9.10E+17,18-09-2017 20:07,"b'Coding is important \xe2\x80\x93 and fun. @CSforAll, thanks for your work to make sure every kid can compete in a high-tech, g\xe2\x80\xa6 https://t.co/xwlnvxsjKb'",4,31379,152391,101652970,623384,5956,20389
BarackObama,9.08E+17,13-09-2017 14:08,"b""Michelle and I want the @ObamaFoundation to inspire and empower people to change the world. Here's how we're gettin\xe2\x80\xa6 https://t.co/xY0UhBSvqp""",0,64935,263448,101652970,623384,5956,20389
BarackObama,9.07E+17,11-09-2017 15:32,b'We remember everyone we lost on 9/11 and honor all who defend our country and our ideals. No act of terror will ever change who we are.',0,343469,1366793,101652970,623384,5956,20389
BarackObama,9.07E+17,10-09-2017 15:56,"b'RT @GeorgeHWBush: Across the U.S., Americans have answered the call to help with hurricane recovery. Praying for all Floridians. #Irma http\xe2\x80\xa6'",0,6651,0,101652970,623384,5956,20389
BarackObama,9.06E+17,08-09-2017 21:34,b'Proud of these McKinley Tech students\xe2\x80\x94inspiring young minds that make me hopeful about our future. https://t.co/nqYC1mjjTB',4,31324,237547,101652970,623384,5956,20389
BarackObama,9.06E+17,07-09-2017 23:06,b'Americans always answer the call. https://t.co/SV1jixOExu https://t.co/ktEvL6s89d',0,100362,333978,101652970,623384,5956,20389
BarackObama,9.05E+17,05-09-2017 18:52,"b'To target hopeful young strivers who grew up here is wrong, because they\xe2\x80\x99ve done nothing wrong. My statement: https://t.co/TCxZdld7L4'",-4,382834,919687,101652970,623384,5956,20389
BarackObama,9.02E+17,27-08-2017 23:14,"b""Thank you to all the first responders and people helping each other out. That's what we do as Americans. Here's one\xe2\x80\xa6 https://t.co/I3RHWyZe31""",4,244371,827591,101652970,623384,5956,20389
BarackObama,8.98E+17,17-08-2017 19:15,b'Michelle and I are thinking of the victims and their families in Barcelona. Americans will always stand with our Spanish friends. Un abrazo.',0,317595,1612653,101652970,623384,5956,20389
BarackObama,8.97E+17,13-08-2017 00:06,"b'""...For love comes more naturally to the human heart than its opposite."" - Nelson Mandela'",4,410028,1406732,101652970,623384,5956,20389
BarackObama,8.97E+17,13-08-2017 00:06,"b'""People must learn to hate, and if they can learn to hate, they can be taught to love...""'",-4,495694,1577368,101652970,623384,5956,20389
BarackObama,8.97E+17,13-08-2017 00:06,"b'""No one is born hating another person because of the color of his skin or his background or his religion..."" https://t.co/InZ58zkoAm'",0,1709780,4588636,101652970,623384,5956,20389
BarackObama,8.88E+17,20-07-2017 00:49,"b""John McCain is an American hero &amp; one of the bravest fighters I've ever known. Cancer doesn't know what it's up against. Give it hell, John.""",0,411194,2083982,101652970,623384,5956,20389
BarackObama,8.78E+17,22-06-2017 19:41,"b""Health care has always been about something bigger than politics: it's about the character of our country. https://t.co/UqLO14Hef7""",0,130819,443987,101652970,623384,5956,20389
BarackObama,8.76E+17,18-06-2017 15:09,"b""Of all that I've done in my life, I'm most proud to be Sasha and Malia's dad. To all those lucky enough to be a dad\xe2\x80\xa6 https://t.co/XSqMhcSuvR""",4,254349,1360296,101652970,623384,5956,20389
BarackObama,8.71E+17,02-06-2017 17:35,"b'On this National Gun Violence Awareness Day, let your voice be heard and show your commitment to reducing gun viole\xe2\x80\xa6 https://t.co/S7dth6Ywb0'",0,72361,390827,101652970,623384,5956,20389
BarackObama,8.69E+17,29-05-2017 13:09,b'Forever grateful for the service and sacrifice of all who fought to protect our freedoms and defend this country we\xe2\x80\xa6 https://t.co/BwRS0onlOL',0,131161,704329,101652970,623384,5956,20389
BarackObama,8.68E+17,27-05-2017 13:15,b'Good to see my friend Prince Harry in London to discuss the work of our foundations &amp; offer condolences to victims\xe2\x80\xa6 https://t.co/f1U8It8AmE',4,75075,495735,101652970,623384,5956,20389
BarackObama,8.68E+17,25-05-2017 14:13,"b'Through faith, love, and resolve the character of the people of Manchester has shown itself.  Our thoughts &amp; prayer\xe2\x80\xa6 https://t.co/xyMer891Zo'",4,43121,219878,101652970,623384,5956,20389
BarackObama,8.67E+17,23-05-2017 16:56,b'Our hearts go out to those killed and wounded in Manchester. Americans will always stand shoulder to shoulder with the people of the UK.',-4,221567,1036289,101652970,623384,5956,20389
BarackObama,8.67E+17,22-05-2017 21:16,"b'Excited to hear from Sierra, Imani, Filiz, and Benedikt who are making a difference at home and abroad. See you in\xe2\x80\xa6 https://t.co/bF1kB1GvxC'",4,10019,84148,101652970,623384,5956,20389
BarackObama,8.64E+17,14-05-2017 14:01,"b""Happy Mother's Day to my love and partner on this journey @MichelleObama, and to all the wonderful, hardworking mothers out there.""",4,112054,734525,101652970,623384,5956,20389
BarackObama,8.60E+17,03-05-2017 19:42,"b""We're rolling up our sleeves again, back where it all started. Join us at https://t.co/GYkEOK8EuT. https://t.co/UlyvNrQvZR""",0,24054,122809,101652970,623384,5956,20389
BarackObama,8.59E+17,02-05-2017 17:19,"b""Well said, Jimmy. That's exactly why we fought so hard for the ACA, and why we need to protect it for kids like Bil\xe2\x80\xa6 https://t.co/jB3LXT94Ok""",-4,129732,505184,101652970,623384,5956,20389
BarackObama,8.57E+17,24-04-2017 19:48,b'RT @ObamaFoundation: It\xe2\x80\x99s a beautiful day on the South Side. https://t.co/PtoaFbww0s',4,12051,0,101652970,623384,5956,20389
BarackObama,8.45E+17,23-03-2017 13:00,b'My heart goes out to the victims and their families in London. No act of terror can shake the strength and resilience of our British ally.',0,143391,816112,101652970,623384,5956,20389
BarackObama,8.43E+17,19-03-2017 15:51,"b""Chuck Berry rolled over everyone who came before him \xe2\x80\x93 and turned up everyone who came after.  We'll miss you, Chuck.  Be good.""",4,67282,404261,101652970,623384,5956,20389
BarackObama,8.40E+17,08-03-2017 21:14,"b'On International Women\xe2\x80\x99s Day, @MichelleObama and I are inspired by all of you who embrace your power to drive chang\xe2\x80\xa6 https://t.co/Er9mIQlmgr'",0,51808,274837,101652970,623384,5956,20389
BarackObama,8.37E+17,02-03-2017 19:00,b'RT @ObamaFoundation: Courage comes in many forms. Who in your local community or neighborhood leads by example? #ProfileInCourage https://t\xe2\x80\xa6',4,6900,0,101652970,623384,5956,20389
BarackObama,8.37E+17,02-03-2017 15:22,"b""Humbled to be recognized by a family with a legacy of service. Who's your #ProfileInCourage? Tell me about them:\xe2\x80\xa6 https://t.co/25Ohhab8Xn""",0,18635,106192,101652970,623384,5956,20389
BarackObama,8.33E+17,17-02-2017 19:37,b'We asked. You answered. https://t.co/mAJvko6VqR',0,26933,118502,101652970,623384,5956,20389
BarackObama,8.32E+17,14-02-2017 15:34,"b'Happy Valentine\xe2\x80\x99s Day, @michelleobama! Almost 28 years with you, but it always feels new. https://t.co/O0UhJWoqGN'",4,258434,1108025,101652970,623384,5956,20389
BarackObama,8.23E+17,22-01-2017 18:07,b'I read letters like these every single day. It was one of the best parts of the job \xe2\x80\x93 hearing from you. https://t.co/so1luBcszV',4,35650,239079,101652970,623384,5956,20389
BarackObama,8.23E+17,20-01-2017 21:17,b'RT @ObamaFoundation: Add your voice: https://t.co/mA9MSHmi7o https://t.co/Uf7oEvkZF3',0,49621,0,101652970,623384,5956,20389
BarackObama,8.23E+17,20-01-2017 21:05,"b""In the meantime, I want to hear what you're thinking about the road ahead. So share your ideas with me here: https://t.co/GYkEOK8EuT""",0,53451,238106,101652970,623384,5956,20389
BarackObama,8.23E+17,20-01-2017 21:04,"b'Hi everybody! Back to the original handle. Is this thing still on? Michelle and I are off on a quick vacation, then we\xe2\x80\x99ll get back to work.'",4,430858,1855257,101652970,623384,5956,20389
BarackObama,8.19E+17,10-01-2017 23:44,"b'Tonight, President Obama reflects on eight years of progress. Watch the #FarewellAddress at 9 pm ET: https://t.co/ZnwTsg155B #ObamaFarewell'",0,13802,75976,101652970,623384,5956,20389
BarackObama,7.95E+17,05-11-2016 16:31,"b'RT @OFA: ""Thanks to the Affordable Care Act, your coverage is better today than it was before.""\n\nWatch the weekly address: https://t.co/Pfk\xe2\x80\xa6'",4,3950,0,101652970,623384,5956,20389
BarackObama,7.95E+17,05-11-2016 15:38,"b'In the weekly address, President Obama discusses what #Obamacare has done to improve health care. https://t.co/VdQlyrSZhx'",0,4613,29117,101652970,623384,5956,20389
BarackObama,7.95E+17,04-11-2016 22:16,"b""Let's keep working to keep our economy on a better, stronger course. https://t.co/bV2BVjyj7a""",4,9459,46267,101652970,623384,5956,20389
BarackObama,7.95E+17,04-11-2016 18:25,b'The landmark #ParisAgreement enters into force today\xe2\x80\x94we must keep up the momentum to #ActOnClimate. https://t.co/Cyw5Udaoro',0,6155,25308,101652970,623384,5956,20389
BarackObama,7.95E+17,04-11-2016 16:12,"b'The economy added 161,000 jobs in October, and wages are up 2.8 percent over the past year. https://t.co/pJxjgLnjCt #JobsReport'",-4,3971,17600,101652970,623384,5956,20389
BarackObama,7.94E+17,03-11-2016 21:02,"b""There are a lot of plans out there. Check your options and lock in the one that's best for you: https://t.co/buFY9ozDz4 #GetCovered""",4,1572,9047,101652970,623384,5956,20389
BarackObama,7.94E+17,03-11-2016 19:08,"b""The positive impact of #Obamacare is undeniable, but there's one big factor holding many states back: https://t.co/7XebIdRX34""",4,1940,11355,101652970,623384,5956,20389
BarackObama,7.94E+17,03-11-2016 17:22,"b""RT @POTUS: It happened: @Cubs win World Series. That's change even this South Sider can believe in. Want to come to the White House before\xe2\x80\xa6""",4,72638,0,101652970,623384,5956,20389
BarackObama,7.94E+17,02-11-2016 18:22,"b""Tens of millions of Americans have benefited from #Obamacare. Make sure you're one of them. #GetCovered https://t.co/e1KoXcPtpU""",4,2239,11755,101652970,623384,5956,20389
BarackObama,7.94E+17,02-11-2016 15:13,"b'Thanks to #Obamacare, quality health care is available to everyone. The marketplace is now open\xe2\x80\x94make sure you and y\xe2\x80\xa6 https://t.co/89gl6pzMGD'",4,3258,14652,101652970,623384,5956,20389
BarackObama,7.94E+17,02-11-2016 00:15,b'RT @lacasablanca: La t\xc3\xadpica Latina tarda 22 meses en ganar lo que un hombre blanco gana en 12 meses. Tenemos que cerrar la brecha salarial.\xe2\x80\xa6',0,1780,0,101652970,623384,5956,20389
BarackObama,7.94E+17,01-11-2016 22:26,"b'RT @WhiteHouse: On #LatinaEqualPay Day, we mark the work that remains to ensure that all Americans receive equal pay for equal work. https:\xe2\x80\xa6'",0,2454,0,101652970,623384,5956,20389
BarackObama,7.94E+17,01-11-2016 20:17,b'Community organizing never goes out of style. Shop now: https://t.co/LXEbQdKLLT https://t.co/E56ofoU36i',0,1003,6263,101652970,623384,5956,20389
BarackObama,7.94E+17,01-11-2016 17:55,"b'With #Obamacare, people can focus on treatment for pre-existing conditions without the fear of coverage being cappe\xe2\x80\xa6 https://t.co/jvdFY87XBu'",0,2329,10418,101652970,623384,5956,20389
BarackObama,7.93E+17,01-11-2016 15:54,"b""The Obamacare marketplace is now open. If you're uninsured, now is the time to shop for a plan and #GetCovered.\xe2\x80\xa6 https://t.co/Spjlga4eTT""",0,1114,5582,101652970,623384,5956,20389
BarackObama,7.93E+17,31-10-2016 22:17,b'RT @FLOTUS: Open enrollment starts tomorrow! Check out your options at https://t.co/dg57hwz5of and share your #GetCovered story. https://t.\xe2\x80\xa6',0,3408,0,101652970,623384,5956,20389
BarackObama,7.93E+17,31-10-2016 22:09,b'Lions and Tiggers and bears! Oh my! #HappyHalloween https://t.co/iU4fjBhi0Y',0,6896,33404,101652970,623384,5956,20389
BarackObama,7.93E+17,31-10-2016 20:12,b'Usted y su familia merecen la tranquilidad de saber que est\xc3\xa1n cubiertos. El mercado de seguros abre ma\xc3\xb1ana. https://t.co/9iRCkLRGZD',0,1036,5298,101652970,623384,5956,20389
BarackObama,7.93E+17,31-10-2016 18:08,"b'Speak up in support of quality, affordable health care for all. https://t.co/rGsSguMxvj'",0,1011,5032,101652970,623384,5956,20389
BarackObama,7.93E+17,31-10-2016 17:00,"b""There's nothing to be scared of when searching for health insurance. Three in four people can #GetCovered for less\xe2\x80\xa6 https://t.co/BUmnRO9B3E""",-4,1788,7475,101652970,623384,5956,20389
BarackObama,7.93E+17,31-10-2016 15:33,b'Open enrollment begins tomorrow\xe2\x80\x94make sure you and your loved ones #GetCovered. https://t.co/2aak7Bt0s3',4,1048,4799,101652970,623384,5956,20389
BarackObama,7.93E+17,30-10-2016 22:21,"b""RT @OFA: Witch plan is best for you? Thanks to Obamacare, even pre-existing conditions can't stop you from comparing your options. #GetCove\xe2\x80\xa6""",4,635,0,101652970,623384,5956,20389
BarackObama,7.92E+17,28-10-2016 16:50,"b""Senate leaders' obstruction of our Supreme Court nomination process is unacceptable. Say so: https://t.co/t3pYMO8Fp0 #DoYourJob""",0,1399,5500,101652970,623384,5956,20389
BarackObama,7.92E+17,28-10-2016 15:07,"b""Senate leaders should put the common good above politics\xe2\x80\x94the integrity of our nation's highest court depends on it.\xe2\x80\xa6 https://t.co/iRVCEl1pzf""",4,3737,13057,101652970,623384,5956,20389
BarackObama,7.92E+17,27-10-2016 22:17,"b""Don't ghost on your health and well-being\xe2\x80\x94your chance to #GetCovered is coming up. Open enrollment starts November\xe2\x80\xa6 https://t.co/qwNLazuPiz""",0,1289,6156,101652970,623384,5956,20389
BarackObama,7.92E+17,27-10-2016 21:31,b'Climate change is happening now. Denial is dangerous. https://t.co/0Nlf8Fst4u',-4,4365,10526,101652970,623384,5956,20389
BarackObama,7.92E+17,27-10-2016 20:24,"b""If you're willing to work hard and play by the rules, you should be able to get ahead. https://t.co/394hdJttgO""",4,2044,8468,101652970,623384,5956,20389
BarackObama,7.92E+17,27-10-2016 18:55,b'President Obama lays out just a few of the ways in which #Obamacare has helped millions of Americans. https://t.co/qeqHRLz0ID',-4,1861,7644,101652970,623384,5956,20389
BarackObama,7.92E+17,27-10-2016 17:04,b'New report: Renewable energy installations are beating fossil fuel installations for the first time. https://t.co/MMhIdu4jzt #ActOnClimate',4,1614,4909,101652970,623384,5956,20389
BarackObama,7.92E+17,27-10-2016 15:27,b'Obamacare has helped millions of Americans gain the peace of mind that comes with coverage. Show your support: https://t.co/NfrG7DHL5C',0,1098,4957,101652970,623384,5956,20389
BarackObama,7.91E+17,26-10-2016 19:32,"b'This is what happens when we focus on building an economy that works for everyone, not just those at the top. https://t.co/op3Z74rPeI'",4,2162,7043,101652970,623384,5956,20389
