name,id,date,text,polarity,retweet,fav,follower,friendscount,avg_re,avg_fav
BarackObama,5.71E+17,25-02-2015 16:06,b'Tell new congressional leaders #EnoughAlready\xe2\x80\x94no more manufactured crises over politics: http://t.co/oo3AmsIq4J',4,1134,1205,101652993,623384,5956,20389
BarackObama,5.70E+17,24-02-2015 21:05,"b""ICYMI: A comprehensive immigration reform bill sat on Speaker Boehner's desk for more than 500 days. #EnoughAlready""",4,2058,2043,101652993,623384,5956,20389
BarackObama,5.70E+17,24-02-2015 19:03,b'Some in Congress would choose not to fund @DHSgov rather than fix our broken immigration system. #EnoughAlready',-4,1338,1483,101652993,623384,5956,20389
BarackObama,5.70E+17,24-02-2015 17:17,"b'""It\'s time to end the era of manufactured crises."" \xe2\x80\x94President Obama on #ImmigrationAction http://t.co/yWQLxIl1Cc'",0,1490,1787,101652993,623384,5956,20389
BarackObama,5.70E+17,23-02-2015 23:25,b'Let congressional leaders know that another shutdown is the last thing we need. Add your name now: http://t.co/y4ayySH3dV #EnoughAlready',0,1308,1478,101652993,623384,5956,20389
BarackObama,5.70E+17,23-02-2015 21:29,b'Reminder: The debate in Congress right now is supposed to be about funding the Department of Homeland Security. #EnoughAlready',4,1289,1639,101652993,623384,5956,20389
BarackObama,5.70E+17,23-02-2015 19:36,"b'RT @WhiteHouse: ""In America, after a lifetime of hard work, you should be able to retire with dignity and a sense of security."" \xe2\x80\x94Obama #Pro\xe2\x80\xa6'",4,1265,0,101652993,623384,5956,20389
BarackObama,5.70E+17,23-02-2015 19:06,b'LIVE: President Obama is talking about how strengthening retirement security is good for the middle class. http://t.co/tcc8b52RUA',4,900,1104,101652993,623384,5956,20389
BarackObama,5.70E+17,23-02-2015 18:07,"b'Only two months on the job, the new Congress is already threatening a partial government shutdown. #EnoughAlready http://t.co/8OX0MCxbzc'",4,3148,3309,101652993,623384,5956,20389
BarackObama,5.69E+17,22-02-2015 01:18,"b'In the weekly address, the President discusses opening new markets to grow the economy and support good-paying jobs: http://t.co/iQPq7eWjfe'",4,1153,1571,101652993,623384,5956,20389
BarackObama,5.69E+17,20-02-2015 20:55,b'Every day is #LoveYourPetDay. http://t.co/yxrIDz3gU6',0,11305,21345,101652993,623384,5956,20389
BarackObama,5.69E+17,20-02-2015 18:29,b'Here are eight ways #Obamacare has proved the critics wrong: http://t.co/kjxbQXoraW (h/t @voxdotcom)',-4,1085,1264,101652993,623384,5956,20389
BarackObama,5.69E+17,19-02-2015 23:05,"b""It's more than health insurance\xe2\x80\x94it's peace of mind. http://t.co/nBIJv0evNk""",4,1082,1864,101652993,623384,5956,20389
BarackObama,5.69E+17,19-02-2015 20:00,"b""LIVE: The President announces new national monuments and an initiative to protect the nation's unique outdoor spaces. http://t.co/KyWNB87mKy""",4,547,1100,101652993,623384,5956,20389
BarackObama,5.68E+17,19-02-2015 16:42,"b'""Trade has an important role to play in supporting good-paying, middle-class jobs in the U.S."" \xe2\x80\x94President Obama http://t.co/521E9s0SB4'",4,714,1289,101652993,623384,5956,20389
BarackObama,5.68E+17,18-02-2015 23:39,b'Too many lawmakers still deny the science of climate change. Call them out now: http://t.co/qlquFqhsA6 #ActOnClimate http://t.co/MbzTx9Wz3E',4,2937,3329,101652993,623384,5956,20389
BarackObama,5.68E+17,18-02-2015 15:43,"b""The Affordable Care Act is helping millions of families\xe2\x80\x94we can't go back now. http://t.co/OWOxJreB2m""",0,1163,2096,101652993,623384,5956,20389
BarackObama,5.68E+17,18-02-2015 00:27,b'RT @WhiteHouse: BREAKING: About 11.4 million Americans are signed up for private health coverage. #11MillionAndCounting #ACAWorks\nhttps://t\xe2\x80\xa6',0,1713,0,101652993,623384,5956,20389
BarackObama,5.68E+17,17-02-2015 19:30,"b""RT @FLOTUS: Look who's helping kids #eatbrighter:\n@BillyEichner \xe2\x9c\x93\n@BigBird \xe2\x9c\x93\n@FunnyOrDie \xe2\x9c\x93\n@PMA \xe2\x9c\x93\nThe First Lady \xe2\x9c\x93\nhttp://t.co/YuTbrYlTx1 #\xe2\x80\xa6""",4,516,0,101652993,623384,5956,20389
BarackObama,5.67E+17,16-02-2015 01:07,b'The deadline is here. Go #GetCoveredNow: http://t.co/xTRj74V0N6 http://t.co/ykQVuz3NC8',0,818,1533,101652993,623384,5956,20389
BarackObama,5.67E+17,15-02-2015 17:52,b'Last call for health insurance this year: http://t.co/1jOkVIuE0L #GetCoveredNow',0,672,1294,101652993,623384,5956,20389
BarackObama,5.67E+17,14-02-2015 23:32,"b'""Nothing will determine our success as a nation in the 21st century more than how well we educate our kids."" http://t.co/LD1A7FBBDH'",4,2765,3676,101652993,623384,5956,20389
BarackObama,5.67E+17,14-02-2015 19:07,b'Get it done today: http://t.co/4Z0Bzqjrfn http://t.co/UNJMlJRYsa',0,815,1503,101652993,623384,5956,20389
BarackObama,5.67E+17,14-02-2015 16:49,"b'In the weekly address, the President lays out his plan to ensure more kids graduate from school ready for the future: http://t.co/dMEJG0KJ6Y'",4,670,1418,101652993,623384,5956,20389
BarackObama,5.66E+17,14-02-2015 00:19,b'Just like your favorite romantic comedies\xe2\x80\x94but with benefits: http://t.co/60fxgyjsry #GetCoveredNow',4,540,1312,101652993,623384,5956,20389
BarackObama,5.66E+17,13-02-2015 21:53,b'The United States can make real progress on climate change. Read more from @Podesta44: http://t.co/WZArcVM0IN',4,553,1192,101652993,623384,5956,20389
BarackObama,5.66E+17,13-02-2015 19:34,b'LIVE: President Obama is speaking at the White House #CyberSummit at @Stanford. http://t.co/CXo6EhiiVk',4,457,986,101652993,623384,5956,20389
BarackObama,5.66E+17,13-02-2015 17:01,b'Make sure your loved ones are covered: http://t.co/SWjS2289uU #GetCoveredNow http://t.co/xGHVrBHovH',4,662,1237,101652993,623384,5956,20389
BarackObama,5.66E+17,12-02-2015 23:27,b'Speaking of #YOLO: http://t.co/gHVJID0tvP',0,1615,2492,101652993,623384,5956,20389
BarackObama,5.66E+17,12-02-2015 23:08,"b'So, this happened: http://t.co/bVx7fyDEl3 #CanILive'",0,2970,3769,101652993,623384,5956,20389
BarackObama,5.66E+17,12-02-2015 18:33,b'No more games\xe2\x80\x94Congress should stop the political posturing and make progress on immigration. #EnoughAlready http://t.co/LH2npSuNR4',-4,1567,2277,101652993,623384,5956,20389
BarackObama,5.66E+17,12-02-2015 17:18,b'Three days left: http://t.co/qHVxbtrGnU #GetCovered http://t.co/LNfpXIp470',0,569,1073,101652993,623384,5956,20389
BarackObama,5.66E+17,11-02-2015 20:38,b'Happening now: President Obama discusses taking action against ISIL. http://t.co/HarnB4wWMb',4,709,1222,101652993,623384,5956,20389
BarackObama,5.66E+17,11-02-2015 18:33,b'The President discusses the importance of health care and marriage equality progress in his interview with @BuzzFeed: http://t.co/EGKNHMWp8J',0,564,1206,101652993,623384,5956,20389
BarackObama,5.66E+17,11-02-2015 17:14,"b'Of all the things you do today, getting covered before the enrollment deadline could be the most crucial: http://t.co/3uAVMQWgm4 #GetCovered'",4,471,999,101652993,623384,5956,20389
BarackObama,5.65E+17,10-02-2015 21:13,"b""It's the final countdown: Only five days left in the enrollment period. #GetCovered now. http://t.co/iToBPhVVmy http://t.co/hYgwhVrPa7""",0,579,1212,101652993,623384,5956,20389
BarackObama,5.65E+17,10-02-2015 19:39,"b""It's time to #GetCovered. Watch: http://t.co/EpFCypkQWH""",0,331,870,101652993,623384,5956,20389
BarackObama,5.65E+17,09-02-2015 23:01,b'Joshua got covered so that he could stay healthy\xe2\x80\x94without worrying about expensive premiums. http://t.co/RSnykzs9Xf',-4,627,1526,101652993,623384,5956,20389
BarackObama,5.65E+17,09-02-2015 20:46,b'Repealing the Affordable Care Act would mean millions of Americans could lose their health insurance: http://t.co/LnUNqKlZSw',-4,756,1285,101652993,623384,5956,20389
BarackObama,5.65E+17,09-02-2015 19:06,"b""President Obama sat down with @voxdotcom to discuss health care, the economy, and America's position in the world: http://t.co/5JIJ23wiWH""",-4,437,1054,101652993,623384,5956,20389
BarackObama,5.65E+17,09-02-2015 02:54,b'Watch the message that aired tonight during the #Grammys from President Obama: #ItsOnUs to stop sexual assault. http://t.co/xytAN7mSyW',4,6691,7309,101652993,623384,5956,20389
BarackObama,5.64E+17,07-02-2015 19:00,"b""Watch: In the weekly address, President Obama highlights the country's economic progress. http://t.co/r7fV6DJL2p""",4,558,1261,101652993,623384,5956,20389
BarackObama,5.64E+17,06-02-2015 22:25,b'Watch: These people are why the Affordable Care Act matters. http://t.co/dousOukeLQ',0,521,1252,101652993,623384,5956,20389
BarackObama,5.64E+17,06-02-2015 20:01,"b'""Let\'s roll up our sleeves, work together, and try to get something done."" \xe2\x80\x94President Obama'",0,1668,3003,101652993,623384,5956,20389
BarackObama,5.64E+17,06-02-2015 19:56,"b'""I\'m not pushing these ideas for my sake. I\'m pushing them because I think this is where America needs to go."" \xe2\x80\x94President Obama #Leadership'",0,901,2085,101652993,623384,5956,20389
BarackObama,5.64E+17,06-02-2015 19:53,"b'""At a time when the economy is picking up speed and growing again, we\'ve got to work twice as hard."" \xe2\x80\x94President Obama'",-4,674,1452,101652993,623384,5956,20389
BarackObama,5.64E+17,06-02-2015 19:52,"b'""I want to make sure that this is a country where hard work is rewarded."" \xe2\x80\x94President Obama'",4,1110,2163,101652993,623384,5956,20389
BarackObama,5.64E+17,06-02-2015 19:52,"b'""We have risen from recession, freer to write our own future than any nation on earth."" \xe2\x80\x94President Obama'",4,592,1343,101652993,623384,5956,20389
BarackObama,5.64E+17,06-02-2015 19:47,"b'""America is poised for another good year... as long as Washington works to keep this progress going."" \xe2\x80\x94President Obama'",4,470,1235,101652993,623384,5956,20389
BarackObama,5.64E+17,06-02-2015 19:46,"b'""And, in the single most hopeful sign for middle-class families, wages are starting to go up again."" \xe2\x80\x94President Obama'",4,471,1205,101652993,623384,5956,20389
BarackObama,5.64E+17,06-02-2015 19:44,"b'""Over the past 59 months, the private sector has added almost 12 million new jobs."" \xe2\x80\x94President Obama'",-4,593,1243,101652993,623384,5956,20389
BarackObama,5.64E+17,06-02-2015 19:43,"b'""In 2014, our economy created 3.1 million jobs\xe2\x80\x94and that\'s the best year of job growth since the 1990s."" \xe2\x80\x94President Obama'",4,924,1579,101652993,623384,5956,20389
BarackObama,5.64E+17,06-02-2015 19:31,b'LIVE: The President answers questions from students and faculty at Ivy Tech Community College in Indianapolis. http://t.co/v84rVrP58Z',4,401,753,101652993,623384,5956,20389
BarackObama,5.64E+17,06-02-2015 18:36,b'Tune in at 2:15 p.m. ET to watch President Obama take questions from students on jobs and education at a town hall: http://t.co/jOMmTxPlUt',0,394,851,101652993,623384,5956,20389
BarackObama,5.64E+17,06-02-2015 15:56,"b""The economy added 257,000 jobs in January, part of the strongest three-month growth since 1997. Let's keep it going: http://t.co/bXXbvC1n6k""",0,1292,2070,101652993,623384,5956,20389
BarackObama,5.63E+17,05-02-2015 22:24,b'Good news: Wind and solar energy have tripled since 2008. http://t.co/osh3AsFWqB',4,1509,2670,101652993,623384,5956,20389
BarackObama,5.63E+17,05-02-2015 20:31,"b""WATCH: No one's invincible. http://t.co/gDzSSCx1G5 #GetCovered""",0,372,869,101652993,623384,5956,20389
BarackObama,5.63E+17,05-02-2015 17:06,"b'Jake has coverage he can count on, for less than he expected. #GetCovered http://t.co/NjJhUDnUiR'",-4,563,1383,101652993,623384,5956,20389
BarackObama,5.63E+17,04-02-2015 23:01,b'The last chance to #GetCovered for 2015 is only days away. Find a plan today: http://t.co/4lQezMBknb http://t.co/oTh6b92jJ1',0,817,1185,101652993,623384,5956,20389
BarackObama,5.63E+17,04-02-2015 19:54,"b'Today, President Obama met with young immigrants whose lives are positively affected by #ImmigrationAction. http://t.co/bmYOO4TKwb'",4,730,1474,101652993,623384,5956,20389
BarackObama,5.63E+17,04-02-2015 18:38,b'Not that much time left to #GetCovered: http://t.co/nf95N0Umwf',4,402,962,101652993,623384,5956,20389
BarackObama,5.63E+17,03-02-2015 22:26,"b""RT @OFA: Help commemorate #BlackHistoryMonth\xe2\x80\x94it's on all of us to get involved and make a positive impact: http://t.co/HUpEY5KK9K""",4,357,0,101652993,623384,5956,20389
BarackObama,5.62E+17,02-02-2015 20:05,"b""Check out President Obama's comprehensive budget plan, and see how he's investing in middle-class families: http://t.co/gUcWhfu36y""",0,627,1328,101652993,623384,5956,20389
BarackObama,5.62E+17,02-02-2015 16:48,"b'""We have to pass a budget that gives middle-class families the security they need to get ahead in the new economy."" \xe2\x80\x94President Obama'",4,1366,2797,101652993,623384,5956,20389
BarackObama,5.62E+17,02-02-2015 16:40,b'LIVE: President Obama discusses how his budget will bring middle-class economics into the 21st century. http://t.co/9Y8HDe9GIE',4,492,1166,101652993,623384,5956,20389
BarackObama,5.62E+17,02-02-2015 14:25,"b'RT @OFA: Okay, campers, rise and shine. Another attempt to repeal Obamacare is making it coooold out there today.'",4,333,0,101652993,623384,5956,20389
BarackObama,5.62E+17,31-01-2015 21:16,"b'""I will keep doing everything I can to help more working families make ends meet and get ahead."" \xe2\x80\x94President Obama http://t.co/exNWiYdigT'",4,1439,3241,101652993,623384,5956,20389
BarackObama,5.62E+17,31-01-2015 15:54,"b'In the weekly address, President Obama lays the foundation for focusing on middle-class economics: http://t.co/wOAIO5wiLj'",0,653,1586,101652993,623384,5956,20389
BarackObama,5.61E+17,30-01-2015 22:58,b'Check getting covered off of your to-do list. Find a plan that works for you before the February 15th deadline: http://t.co/rV08U27qC2',0,474,1196,101652993,623384,5956,20389
BarackObama,5.61E+17,30-01-2015 19:53,"b""Climate change deniers, take note: The vast majority of Americans agree that it's time to #ActOnClimate. http://t.co/KTqwd2GQCV""",0,1622,2300,101652993,623384,5956,20389
BarackObama,5.61E+17,30-01-2015 16:19,b'Happening now: President Obama speaks about investing in precision medicine to improve health and disease treatment. http://t.co/uf2kRxhxe5',0,713,1500,101652993,623384,5956,20389
BarackObama,5.61E+17,30-01-2015 00:12,"b'Six years ago, the President signed the Lilly Ledbetter Fair Pay Act\xe2\x80\x94but the fight for equal pay is far from over. http://t.co/isSTQvlWZ1'",4,1709,3632,101652993,623384,5956,20389
BarackObama,5.61E+17,29-01-2015 22:58,b'Parents will always worry about their kids. Give them some peace of mind\xe2\x80\x94#GetCovered today. http://t.co/DGuJEY9TwF #YoEnroll',0,682,1575,101652993,623384,5956,20389
BarackObama,5.61E+17,29-01-2015 17:11,b'RT @WhiteHouse: Worth a read: President Obama on his blueprint for middle-class economics \xe2\x86\x92 http://t.co/7z81jGRcK9 #AmericaLeads http://t.c\xe2\x80\xa6',4,982,0,101652993,623384,5956,20389
BarackObama,5.61E+17,28-01-2015 20:49,"b""Get a state-by-state breakdown on how much the President's #ImmigrationAction will benefit the economy: http://t.co/Lo8J5Q83Ul""",4,750,1482,101652993,623384,5956,20389
BarackObama,5.60E+17,27-01-2015 22:48,"b""9.5 million Americans have signed up for coverage\xe2\x80\x94and we're not done yet. http://t.co/sMCzitJ9zX""",0,902,2045,101652993,623384,5956,20389
BarackObama,5.60E+17,26-01-2015 22:30,b'.@VP stops by @TheEllenShow with a message for young adults: Give your mom some peace of mind and #GetCovered. http://t.co/MqMOsk9bWK',4,647,1750,101652993,623384,5956,20389
BarackObama,5.60E+17,26-01-2015 18:03,"b""If you need health insurance, find a plan that's right for you right now: http://t.co/0UFJ8hjXWt #GetCovered""",4,621,1478,101652993,623384,5956,20389
BarackObama,5.60E+17,26-01-2015 16:44,"b'""People want to see an agenda that moves us all forward."" Read President Obama\'s latest message to @OFA: http://t.co/AvnSlvXzD9'",4,710,1612,101652993,623384,5956,20389
BarackObama,5.59E+17,25-01-2015 21:05,b'RT @WhiteHouse: Big news: President Obama just announced a comprehensive plan to protect Alaska\xe2\x80\x99s Arctic National Wildlife Refuge \xe2\x86\x92 http://\xe2\x80\xa6',0,1532,0,101652993,623384,5956,20389
BarackObama,5.59E+17,24-01-2015 18:52,b'Watch the weekly address: We have to do everything we can to help more Americans get ahead in the new economy. http://t.co/78fbwjSDoQ',4,853,1827,101652993,623384,5956,20389
BarackObama,5.59E+17,24-01-2015 16:52,"b'""Somewhere, the sun is shining, the air is fresh, his team\'s behind him, and Mr. Class\xe2\x80\x94\'Mr. Cub\'\xe2\x80\x94is ready to play two."" \xe2\x80\x94President Obama'",4,2995,4798,101652993,623384,5956,20389
BarackObama,5.59E+17,23-01-2015 21:54,b'LIVE: President Obama is speaking at the U.S. Conference of Mayors. Watch here: http://t.co/1VYEZxI1sE',4,517,1249,101652993,623384,5956,20389
BarackObama,5.59E+17,23-01-2015 20:41,b'These senators are at odds with 97% of climate scientists and NASA. #ActOnClimate http://t.co/zYUuwl7AFb',0,5931,6062,101652993,623384,5956,20389
BarackObama,5.59E+17,23-01-2015 15:57,"b""Watch: Don't be THAT person. Stop waiting around and #GetCovered today. http://t.co/JpjjF56nUh""",0,407,1048,101652993,623384,5956,20389
BarackObama,5.58E+17,22-01-2015 23:28,"b'""I am deeply committed to protecting this core constitutional right."" \xe2\x80\x94President Obama on the 42nd anniversary of #RoevWade'",4,1498,3051,101652993,623384,5956,20389
BarackObama,5.58E+17,22-01-2015 22:09,"b'Happening now: President Obama is being interviewed by @YouTube stars Bethany Mota, GloZell Green and Hank Green. http://t.co/zuQTNEQ40d'",-4,906,2104,101652993,623384,5956,20389
BarackObama,5.58E+17,22-01-2015 21:00,"b""Read President Obama's latest message to @OFA supporters after his State of the Union address: http://t.co/0wx6bFgQ6b""",4,342,783,101652993,623384,5956,20389
BarackObama,5.58E+17,22-01-2015 19:41,"b""Find out which senators just went on the record to say that man-made climate change isn't real: http://t.co/Nbeqct6iHG #ActOnClimate""",4,1585,1675,101652993,623384,5956,20389
BarackObama,5.58E+17,22-01-2015 17:34,b'LIVE: President Obama is speaking at @KUNews about middle-class economics. Tune in: http://t.co/DAJMCOnFQ1',4,485,1037,101652993,623384,5956,20389
BarackObama,5.58E+17,22-01-2015 17:06,b'Next stop: Kansas. Tune in at 12:25 p.m. ET to watch President Obama talk about middle-class economics. http://t.co/m4PValiRjb',0,473,1124,101652993,623384,5956,20389
BarackObama,5.58E+17,21-01-2015 23:26,"b'RT @OFA: After his State of the Union address, President Obama sent a message for OFA supporters. Read it here: http://t.co/BPshO1WHa8'",0,271,0,101652993,623384,5956,20389
BarackObama,5.58E+17,21-01-2015 22:04,"b'LIVE: A day after his State of the Union address, President Obama is in Idaho spekaing at @BoiseStateLive. Tune in: http://t.co/gDQwNgjSf3'",4,422,1104,101652993,623384,5956,20389
BarackObama,5.58E+17,21-01-2015 19:39,b'President Obama is doing what he can to fight for middle-class families. Take a stand on this: http://t.co/fChzMIQOlZ',0,682,1506,101652993,623384,5956,20389
BarackObama,5.58E+17,21-01-2015 17:41,"b""It's #BigBlockOfCheeseDay: Check out the schedule of White House staff answering your questions. http://t.co/g2EKBztnvL""",0,549,1147,101652993,623384,5956,20389
BarackObama,5.58E+17,21-01-2015 03:43,"b""Let's go. http://t.co/G7wWN15opl""",0,7462,11972,101652993,623384,5956,20389
BarackObama,5.58E+17,21-01-2015 03:20,"b'RT @OFA: The cynics are wrong. If you refuse to give in to cynicism, this is the movement for you: http://t.co/iq2CLxKyv6 #SOTU'",-4,398,0,101652993,623384,5956,20389
BarackObama,5.58E+17,21-01-2015 03:16,"b'""Let\xe2\x80\x99s begin this new chapter\xe2\x80\x94together\xe2\x80\x94and let\xe2\x80\x99s start the work right now."" \xe2\x80\x94President Obama #SOTU #AmericaLeads'",4,2647,4087,101652993,623384,5956,20389
BarackObama,5.58E+17,21-01-2015 03:15,"b'""My fellow Americans, we too are a strong, tight-knit family. We, too, have made it through some hard times."" \xe2\x80\x94President Obama #SOTU'",4,2171,3754,101652993,623384,5956,20389
BarackObama,5.58E+17,21-01-2015 03:12,"b'""I want future generations to know that we are a people that see our differences as a great gift."" \xe2\x80\x94President Obama #SOTU'",4,5856,6451,101652993,623384,5956,20389
BarackObama,5.58E+17,21-01-2015 03:10,"b'""If you share the broad vision I outlined tonight, join me in the work at hand."" \xe2\x80\x94President Obama #SOTU #AmericaLeads'",4,1760,2863,101652993,623384,5956,20389
BarackObama,5.58E+17,21-01-2015 03:10,"b'RT @WhiteHouse: ""I said this because I had seen it in my own life, in a nation that gave someone like me a chance."" \xe2\x80\x94Obama #SOTU http://t.c\xe2\x80\xa6'",4,2423,0,101652993,623384,5956,20389
BarackObama,5.58E+17,21-01-2015 03:08,"b'""It\xe2\x80\x99s possible to shape a law that upholds our tradition as a nation of laws and a nation of immigrants."" \xe2\x80\x94President Obama #SOTU'",0,1557,2319,101652993,623384,5956,20389
BarackObama,5.58E+17,21-01-2015 03:08,b'Retweet if you agree: #LoveIsLove. #SOTU http://t.co/rDiOb8I6w1',0,23536,16903,101652993,623384,5956,20389
BarackObama,5.58E+17,21-01-2015 03:07,"b'""I\xe2\x80\x99ve seen something like gay marriage go from a wedge issue used to drive us apart to a story of freedom."" \xe2\x80\x94President Obama #SOTU'",4,4083,6175,101652993,623384,5956,20389
BarackObama,5.58E+17,21-01-2015 03:04,"b'""I know the good, and optimistic, and big-hearted generosity of the American people."" \xe2\x80\x94 President Obama #SOTU'",4,1039,2069,101652993,623384,5956,20389
BarackObama,5.58E+17,21-01-2015 03:04,"b'""I still believe we are one people. I still believe that together, we can do great things, even when the odds are long."" \xe2\x80\x94President Obama'",4,3502,3983,101652993,623384,5956,20389
BarackObama,5.58E+17,21-01-2015 03:02,"b'""I know how tempting such cynicism may be. But I still think the cynics are wrong."" \xe2\x80\x94President Obama #SOTU'",-4,1214,2017,101652993,623384,5956,20389
BarackObama,5.58E+17,21-01-2015 03:01,"b'""Leading\xe2\x80\x8a\xe2\x80\x94\xe2\x80\x8aalways\xe2\x80\x8a\xe2\x80\x94\xe2\x80\x8awith the example of our values. That\xe2\x80\x99s what makes us exceptional. That\xe2\x80\x99s what keeps us strong."" \xe2\x80\x94 President Obama #SOTU'",4,1457,1957,101652993,623384,5956,20389
BarackObama,5.58E+17,21-01-2015 02:57,"b'""I will not let this Congress endanger the health of our children by turning back our efforts."" \xe2\x80\x94President Obama #SOTU #ActOnClimate'",0,1865,2855,101652993,623384,5956,20389
BarackObama,5.58E+17,21-01-2015 02:56,"b'""14 of the 15 warmest years on record have all fallen in the first 15 years of this century."" \xe2\x80\x94President Obama #SOTU #ActOnClimate'",4,2217,2586,101652993,623384,5956,20389
BarackObama,5.58E+17,21-01-2015 02:55,"b'""No challenge poses a greater threat to future generations than climate change."" \xe2\x80\x94President Obama #SOTU #ActOnClimate'",4,2993,3191,101652993,623384,5956,20389
BarackObama,5.58E+17,21-01-2015 02:53,b'The science is clear: We have to #ActOnClimate. #SOTU http://t.co/G0cTqYub9q',4,4751,4603,101652993,623384,5956,20389
BarackObama,5.58E+17,21-01-2015 02:50,"b'""When what you\'re doing hasn\'t worked for 50 years, it\'s time to try something new."" \xe2\x80\x94President Obama #SOTU'",4,4953,5134,101652993,623384,5956,20389
BarackObama,5.58E+17,21-01-2015 02:47,b'RT @OFA: America should lead on science and technology and Americans should win the race on the kinds of discoveries that unleash new jobs.\xe2\x80\xa6',4,410,0,101652993,623384,5956,20389
BarackObama,5.58E+17,21-01-2015 02:46,"b'RT @WhiteHouse: ""We need a tax code that truly helps working Americans"" \xe2\x80\x94Obama #SOTU #MiddleClassTaxCuts http://t.co/gjhKy292KG'",0,1302,0,101652993,623384,5956,20389
BarackObama,5.58E+17,21-01-2015 02:45,"b'""We need a tax code that truly helps working Americans trying to get a leg up in the new economy."" \xe2\x80\x94President Obama #SOTU'",4,1264,1868,101652993,623384,5956,20389
BarackObama,5.58E+17,21-01-2015 02:45,"b'""When it comes to issues like infrastructure and basic research, I know there\xe2\x80\x99s bipartisan support in this chamber."" \xe2\x80\x94President Obama #SOTU'",0,627,1086,101652993,623384,5956,20389
BarackObama,5.58E+17,21-01-2015 02:43,"b'""21st century businesses will rely on American science, technology, research and development."" \xe2\x80\x94President Obama #SOTU'",0,1016,1373,101652993,623384,5956,20389
BarackObama,5.58E+17,21-01-2015 02:43,"b'""Let\xe2\x80\x99s pass a bipartisan infrastructure plan that could create more than 30 times as many jobs per year.\xe2\x80\x9d \xe2\x80\x94President Obama #SOTU'",4,1138,1576,101652993,623384,5956,20389
BarackObama,5.58E+17,21-01-2015 02:40,"b'""To every CEO in America: If you want someone who will get the job done and done right, hire a veteran."" \xe2\x80\x94President Obama #SOTU'",4,2384,3198,101652993,623384,5956,20389
BarackObama,5.58E+17,21-01-2015 02:39,"b'""As a new generation of veterans come home, we owe them every opportunity to live the American dream they helped defend."" \xe2\x80\x94President Obama'",4,2141,2768,101652993,623384,5956,20389
BarackObama,5.58E+17,21-01-2015 02:38,"b'""Free community college is possible\xe2\x80\x94and I want to spread that idea all across America."" \xe2\x80\x94President Obama #SOTU'",4,4563,4899,101652993,623384,5956,20389
BarackObama,5.58E+17,21-01-2015 02:36,"b""RT @OFA: If you're nodding your head during President Obama's #SOTU, you should be part of this: http://t.co/iq2CLxKyv6""",0,258,0,101652993,623384,5956,20389
BarackObama,5.58E+17,21-01-2015 02:36,"b'""That\xe2\x80\x99s why I am sending this Congress a bold new plan to lower the cost of community college\xe2\x80\x94to zero."" \xe2\x80\x94President Obama #SOTU'",4,3338,4010,101652993,623384,5956,20389
